<?xml version="1.0" encoding="UTF-8"?>
<biblioteca xsi:noNamespaceSchemaLocation="biblioteca.xsd" xmlns:xsi="http://www.w3.org/2001/XMLSchema-instance">
	<libros>
		<libro>
			<ISBN>String</ISBN>
			<titulo>String</titulo>
			<autor>String</autor>
			<numeroPaginas>0</numeroPaginas>
			<fechaPublicacion>1967-08-13</fechaPublicacion>
			<prestadoSiNo>No</prestadoSiNo>
			<fechaDevolucion>1967-08-13</fechaDevolucion>
		</libro>
		<libro>
			<ISBN>String</ISBN>
			<titulo>String</titulo>
			<autor>String</autor>
			<numeroPaginas>0</numeroPaginas>
			<fechaPublicacion>1967-08-13</fechaPublicacion>
			<prestadoSiNo>Si</prestadoSiNo>
			<fechaDevolucion>1967-08-13</fechaDevolucion>
		</libro>
		<libro>
			<ISBN>String</ISBN>
			<titulo>String</titulo>
			<autor>String</autor>
			<numeroPaginas>0</numeroPaginas>
			<fechaPublicacion>1967-08-13</fechaPublicacion>
			<prestadoSiNo>No</prestadoSiNo>
			<fechaDevolucion>1967-08-13</fechaDevolucion>
		</libro>
	</libros>
	<socios>
		<socio>
			<codigoSocio>222</codigoSocio>
			<nombreSocio>Pepa</nombreSocio>
			<apellidoSocio>García</apellidoSocio>
			<apellidoSocio>García</apellidoSocio>
			<telefono>666111666</telefono>
			<librosPrestados>
				<prestamo>
					<ISBN>String</ISBN>
					<titulo>String</titulo>
					<codigoSocio>String</codigoSocio>
					<nombreSocio>String</nombreSocio>
					<apellidoSocio>String</apellidoSocio>
					<fechaDevolucion>1967-08-13</fechaDevolucion>
				</prestamo>
				<prestamo>
					<ISBN>String</ISBN>
					<titulo>String</titulo>
					<codigoSocio>String</codigoSocio>
					<nombreSocio>String</nombreSocio>
					<apellidoSocio>String</apellidoSocio>
					<fechaDevolucion>1967-08-13</fechaDevolucion>
				</prestamo>
				<prestamo>
					<ISBN>String</ISBN>
					<titulo>String</titulo>
					<codigoSocio>String</codigoSocio>
					<nombreSocio>String</nombreSocio>
					<apellidoSocio>String</apellidoSocio>
					<fechaDevolucion>1967-08-13</fechaDevolucion>
				</prestamo>
			</librosPrestados>
		</socio>
		<socio>
			<codigoSocio>333</codigoSocio>
			<nombreSocio>Manolo</nombreSocio>
			<apellidoSocio>String</apellidoSocio>
			<apellidoSocio>String</apellidoSocio>
			<telefono>0</telefono>
			<librosPrestados>
				<prestamo>
					<ISBN>String</ISBN>
					<titulo>String</titulo>
					<codigoSocio>String</codigoSocio>
					<nombreSocio>String</nombreSocio>
					<apellidoSocio>String</apellidoSocio>
					<fechaDevolucion>1967-08-13</fechaDevolucion>
				</prestamo>
				<prestamo>
					<ISBN>String</ISBN>
					<titulo>String</titulo>
					<codigoSocio>String</codigoSocio>
					<nombreSocio>String</nombreSocio>
					<apellidoSocio>String</apellidoSocio>
					<fechaDevolucion>1967-08-13</fechaDevolucion>
				</prestamo>
				<prestamo>
					<ISBN>String</ISBN>
					<titulo>String</titulo>
					<codigoSocio>String</codigoSocio>
					<nombreSocio>String</nombreSocio>
					<apellidoSocio>String</apellidoSocio>
					<fechaDevolucion>1967-08-13</fechaDevolucion>
				</prestamo>
			</librosPrestados>
		</socio>
		<socio>
			<codigoSocio>String</codigoSocio>
			<nombreSocio>String</nombreSocio>
			<apellidoSocio>String</apellidoSocio>
			<apellidoSocio>String</apellidoSocio>
			<telefono>0</telefono>
			<librosPrestados>
				<prestamo>
					<ISBN>String</ISBN>
					<titulo>String</titulo>
					<codigoSocio>String</codigoSocio>
					<nombreSocio>String</nombreSocio>
					<apellidoSocio>String</apellidoSocio>
					<fechaDevolucion>1967-08-13</fechaDevolucion>
				</prestamo>
				<prestamo>
					<ISBN>String</ISBN>
					<titulo>String</titulo>
					<codigoSocio>String</codigoSocio>
					<nombreSocio>String</nombreSocio>
					<apellidoSocio>String</apellidoSocio>
					<fechaDevolucion>1967-08-13</fechaDevolucion>
				</prestamo>
				<prestamo>
					<ISBN>String</ISBN>
					<titulo>String</titulo>
					<codigoSocio>String</codigoSocio>
					<nombreSocio>String</nombreSocio>
					<apellidoSocio>String</apellidoSocio>
					<fechaDevolucion>1967-08-13</fechaDevolucion>
				</prestamo>
			</librosPrestados>
		</socio>
	</socios>
	<prestamos>
		<prestamo>
			<ISBN>String</ISBN>
			<titulo>String</titulo>
			<codigoSocio>String</codigoSocio>
			<nombreSocio>String</nombreSocio>
			<apellidoSocio>String</apellidoSocio>
			<fechaDevolucion>1967-08-13</fechaDevolucion>
		</prestamo>
		<prestamo>
			<ISBN>String</ISBN>
			<titulo>String</titulo>
			<codigoSocio>String</codigoSocio>
			<nombreSocio>String</nombreSocio>
			<apellidoSocio>String</apellidoSocio>
			<fechaDevolucion>1967-08-13</fechaDevolucion>
		</prestamo>
		<prestamo>
			<ISBN>String</ISBN>
			<titulo>String</titulo>
			<codigoSocio>String</codigoSocio>
			<nombreSocio>String</nombreSocio>
			<apellidoSocio>String</apellidoSocio>
			<fechaDevolucion>1967-08-13</fechaDevolucion>
		</prestamo>
	</prestamos>
</biblioteca>
